{"expected_commit":"1111111111111111111111111111111111111111","guest":{"architecture":"amd64","cargo_version":"1.85.0","debian_version":"13","rustc_version":"1.85.0","systemd_version":257,"virtualization":"kvm"},"image_release_build":"20260826-2582","image_sha512":"aaaaaaaaaaaaaaaaaaaaaaaaaaaaaaaaaaaaaaaaaaaaaaaaaaaaaaaaaaaaaaaaaaaaaaaaaaaaaaaaaaaaaaaaaaaaaaaaaaaaaaaaaaaaaaaaaaaaaaaaaaaaaaaa","proof_network":{"external_https":"denied","mode":"qemu-user-restrict-on"},"report_kind":"volparossa-helper-restart-may-own-custody-relay-vm-environment","report_sha256":"4f8713231f7bb24389d77905c19cde1d8c8d365c02d3bb2d2c483b4cc36749e1","schema_version":1,"status":"PASS"}
